{
  "$schema": "https://json-schema.org/draft/2020-12/schema",
  "$id": "xdebug.axi.config.load.request.v1",
  "title": "axi.config.load request",
  "type": "object",
  "required": [
    "api_version",
    "action",
    "args"
  ],
  "properties": {
    "api_version": {
      "type": "string",
      "enum": [
        "xdebug.v1"
      ]
    },
    "request_id": {
      "type": "string"
    },
    "action": {
      "type": "string",
      "enum": [
        "axi.config.load"
      ]
    },
    "target": {
      "type": "object"
    },
    "args": {
      "type": "object",
      "properties": {
        "config": {
          "type": "object",
          "description": "内联配置对象。"
        },
        "config_path": {
          "type": "string",
          "description": "输入配置文件路径。"
        },
        "include_transactions": {
          "type": "boolean"
        },
        "name": {
          "type": "string",
          "description": "已保存配置、游标、列表或接口配置名称。"
        },
        "time_unit": {
          "type": "string",
          "enum": [
            "auto",
            "fs",
            "ps",
            "ns",
            "us",
            "ms",
            "s"
          ]
        }
      },
      "additionalProperties": false,
      "required": [
        "name"
      ],
      "anyOf": [
        {
          "required": [
            "config"
          ]
        },
        {
          "required": [
            "config_path"
          ]
        }
      ]
    },
    "limits": {
      "type": "object"
    },
    "output": {
      "type": "object"
    },
    "auth_token": {
      "type": "string"
    }
  },
  "additionalProperties": false,
  "description": "axi.config.load: 加载 AXI 配置。",
  "x-purpose": "加载 AXI 配置。",
  "x-how_it_works": "保存 AXI channel 信号映射。",
  "x-when_to_use": "定义后续 AXI 查询对象。",
  "x-arg_contract_notes": "required: name; also one of: config / config_path"
}
