{
  "api_version": "xdebug.v1",
  "action": "axi.config.load",
  "target": {
    "session_id": "case_a"
  },
  "args": {
    "name": "if0",
    "config": {
      "clock": "axi_vip_fixture_top.clk",
      "reset": {"signal": "axi_vip_fixture_top.rst_n", "polarity": "active_low"},
      "edge": "posedge",
      "awaddr": "axi_vip_fixture_top.axi_vip_if.master_if[0].awaddr",
      "awid": "axi_vip_fixture_top.axi_vip_if.master_if[0].awid",
      "awlen": "axi_vip_fixture_top.axi_vip_if.master_if[0].awlen",
      "awsize": "axi_vip_fixture_top.axi_vip_if.master_if[0].awsize",
      "awburst": "axi_vip_fixture_top.axi_vip_if.master_if[0].awburst",
      "awvalid": "axi_vip_fixture_top.axi_vip_if.master_if[0].awvalid",
      "awready": "axi_vip_fixture_top.axi_vip_if.master_if[0].awready",
      "wdata": "axi_vip_fixture_top.axi_vip_if.master_if[0].wdata",
      "wstrb": "axi_vip_fixture_top.axi_vip_if.master_if[0].wstrb",
      "wlast": "axi_vip_fixture_top.axi_vip_if.master_if[0].wlast",
      "wvalid": "axi_vip_fixture_top.axi_vip_if.master_if[0].wvalid",
      "wready": "axi_vip_fixture_top.axi_vip_if.master_if[0].wready",
      "bid": "axi_vip_fixture_top.axi_vip_if.master_if[0].bid",
      "bresp": "axi_vip_fixture_top.axi_vip_if.master_if[0].bresp",
      "bvalid": "axi_vip_fixture_top.axi_vip_if.master_if[0].bvalid",
      "bready": "axi_vip_fixture_top.axi_vip_if.master_if[0].bready",
      "araddr": "axi_vip_fixture_top.axi_vip_if.master_if[0].araddr",
      "arid": "axi_vip_fixture_top.axi_vip_if.master_if[0].arid",
      "arlen": "axi_vip_fixture_top.axi_vip_if.master_if[0].arlen",
      "arsize": "axi_vip_fixture_top.axi_vip_if.master_if[0].arsize",
      "arburst": "axi_vip_fixture_top.axi_vip_if.master_if[0].arburst",
      "arvalid": "axi_vip_fixture_top.axi_vip_if.master_if[0].arvalid",
      "arready": "axi_vip_fixture_top.axi_vip_if.master_if[0].arready",
      "rid": "axi_vip_fixture_top.axi_vip_if.master_if[0].rid",
      "rdata": "axi_vip_fixture_top.axi_vip_if.master_if[0].rdata",
      "rresp": "axi_vip_fixture_top.axi_vip_if.master_if[0].rresp",
      "rlast": "axi_vip_fixture_top.axi_vip_if.master_if[0].rlast",
      "rvalid": "axi_vip_fixture_top.axi_vip_if.master_if[0].rvalid",
      "rready": "axi_vip_fixture_top.axi_vip_if.master_if[0].rready"
    }
  }
}
